[Port4]  :  ELAN WBF Fingerprint Sensor


Is Port User Connectable:         no
Is Port Debug Capable:            no
Companion Port Number:            0
Companion Hub Symbolic Link Name: 
Protocols Supported:
 USB 1.1:                         yes
 USB 2.0:                         yes
 USB 3.0:                         no

Device Power State:               PowerDeviceD2

       ---===>Device Information<===---
String Descriptor for index 2 not available while device is in low power state.

ConnectionStatus:                  
Current Config Value:              0x01  -> Device Bus Speed: Full (is not SuperSpeed or higher capable)
Device Address:                    0x01
Open Pipes:                           8

          ===>Device Descriptor<===
bLength:                           0x12
bDescriptorType:                   0x01
bcdUSB:                          0x0200
bDeviceClass:                      0x00  -> This is an Interface Class Defined Device
bDeviceSubClass:                   0x00
bDeviceProtocol:                   0x00
bMaxPacketSize0:                   0x08 = (8) Bytes
idVendor:                        0x04F3 = ELAN Microelectronics Corportation
idProduct:                       0x0C4C
bcdDevice:                       0x0305
iManufacturer:                     0x01
String Descriptor for index 1 not available while device is in low power state.
iProduct:                          0x02
String Descriptor for index 2 not available while device is in low power state.
iSerialNumber:                     0x00
bNumConfigurations:                0x01

          ---===>Open Pipes<===---

          ===>Endpoint Descriptor<===
bLength:                           0x07
bDescriptorType:                   0x05
bEndpointAddress:                  0x81  -> Direction: IN - EndpointID: 1
bmAttributes:                      0x02  -> Bulk Transfer Type
wMaxPacketSize:                  0x0040 = 0x40 bytes
bInterval:                         0x01

          ===>Endpoint Descriptor<===
bLength:                           0x07
bDescriptorType:                   0x05
bEndpointAddress:                  0x01  -> Direction: OUT - EndpointID: 1
bmAttributes:                      0x02  -> Bulk Transfer Type
wMaxPacketSize:                  0x0040 = 0x40 bytes
bInterval:                         0x01

          ===>Endpoint Descriptor<===
bLength:                           0x07
bDescriptorType:                   0x05
bEndpointAddress:                  0x82  -> Direction: IN - EndpointID: 2
bmAttributes:                      0x02  -> Bulk Transfer Type
wMaxPacketSize:                  0x0040 = 0x40 bytes
bInterval:                         0x01

          ===>Endpoint Descriptor<===
bLength:                           0x07
bDescriptorType:                   0x05
bEndpointAddress:                  0x02  -> Direction: OUT - EndpointID: 2
bmAttributes:                      0x02  -> Bulk Transfer Type
wMaxPacketSize:                  0x0040 = 0x40 bytes
bInterval:                         0x01

          ===>Endpoint Descriptor<===
bLength:                           0x07
bDescriptorType:                   0x05
bEndpointAddress:                  0x83  -> Direction: IN - EndpointID: 3
bmAttributes:                      0x02  -> Bulk Transfer Type
wMaxPacketSize:                  0x0040 = 0x40 bytes
bInterval:                         0x01

          ===>Endpoint Descriptor<===
bLength:                           0x07
bDescriptorType:                   0x05
bEndpointAddress:                  0x03  -> Direction: OUT - EndpointID: 3
bmAttributes:                      0x02  -> Bulk Transfer Type
wMaxPacketSize:                  0x0040 = 0x40 bytes
bInterval:                         0x01

          ===>Endpoint Descriptor<===
bLength:                           0x07
bDescriptorType:                   0x05
bEndpointAddress:                  0x84  -> Direction: IN - EndpointID: 4
bmAttributes:                      0x02  -> Bulk Transfer Type
wMaxPacketSize:                  0x0040 = 0x40 bytes
bInterval:                         0x01

          ===>Endpoint Descriptor<===
bLength:                           0x07
bDescriptorType:                   0x05
bEndpointAddress:                  0x04  -> Direction: OUT - EndpointID: 4
bmAttributes:                      0x02  -> Bulk Transfer Type
wMaxPacketSize:                  0x0040 = 0x40 bytes
bInterval:                         0x01

       ---===>Full Configuration Descriptor<===---

          ===>Configuration Descriptor<===
bLength:                           0x09
bDescriptorType:                   0x02
wTotalLength:                    0x0053  -> Validated
bNumInterfaces:                    0x01
bConfigurationValue:               0x01
iConfiguration:                    0x00
bmAttributes:                      0xA0  -> Bus Powered
  -> Remote Wakeup
MaxPower:                          0x32 = 100 mA

          ===>Interface Descriptor<===
bLength:                           0x09
bDescriptorType:                   0x04
bInterfaceNumber:                  0x00
bAlternateSetting:                 0x00
bNumEndpoints:                     0x08
bInterfaceClass:                   0xFF  -> Interface Class Unknown to USBView
bInterfaceSubClass:                0x00
bInterfaceProtocol:                0x00
iInterface:                        0x00

          ===>HID Descriptor<===
bLength:                           0x09
bDescriptorType:                   0x21
bcdHID:                          0x0110
bCountryCode:                      0x00
bNumDescriptors:                   0x01
bDescriptorType:                   0x22 (Report Descriptor)
wDescriptorLength:               0x0015

          ===>Endpoint Descriptor<===
bLength:                           0x07
bDescriptorType:                   0x05
bEndpointAddress:                  0x81  -> Direction: IN - EndpointID: 1
bmAttributes:                      0x02  -> Bulk Transfer Type
wMaxPacketSize:                  0x0040 = 0x40 bytes
bInterval:                         0x01

          ===>Endpoint Descriptor<===
bLength:                           0x07
bDescriptorType:                   0x05
bEndpointAddress:                  0x01  -> Direction: OUT - EndpointID: 1
bmAttributes:                      0x02  -> Bulk Transfer Type
wMaxPacketSize:                  0x0040 = 0x40 bytes
bInterval:                         0x01

          ===>Endpoint Descriptor<===
bLength:                           0x07
bDescriptorType:                   0x05
bEndpointAddress:                  0x82  -> Direction: IN - EndpointID: 2
bmAttributes:                      0x02  -> Bulk Transfer Type
wMaxPacketSize:                  0x0040 = 0x40 bytes
bInterval:                         0x01

          ===>Endpoint Descriptor<===
bLength:                           0x07
bDescriptorType:                   0x05
bEndpointAddress:                  0x02  -> Direction: OUT - EndpointID: 2
bmAttributes:                      0x02  -> Bulk Transfer Type
wMaxPacketSize:                  0x0040 = 0x40 bytes
bInterval:                         0x01

          ===>Endpoint Descriptor<===
bLength:                           0x07
bDescriptorType:                   0x05
bEndpointAddress:                  0x83  -> Direction: IN - EndpointID: 3
bmAttributes:                      0x02  -> Bulk Transfer Type
wMaxPacketSize:                  0x0040 = 0x40 bytes
bInterval:                         0x01

          ===>Endpoint Descriptor<===
bLength:                           0x07
bDescriptorType:                   0x05
bEndpointAddress:                  0x03  -> Direction: OUT - EndpointID: 3
bmAttributes:                      0x02  -> Bulk Transfer Type
wMaxPacketSize:                  0x0040 = 0x40 bytes
bInterval:                         0x01

          ===>Endpoint Descriptor<===
bLength:                           0x07
bDescriptorType:                   0x05
bEndpointAddress:                  0x84  -> Direction: IN - EndpointID: 4
bmAttributes:                      0x02  -> Bulk Transfer Type
wMaxPacketSize:                  0x0040 = 0x40 bytes
bInterval:                         0x01

          ===>Endpoint Descriptor<===
bLength:                           0x07
bDescriptorType:                   0x05
bEndpointAddress:                  0x04  -> Direction: OUT - EndpointID: 4
bmAttributes:                      0x02  -> Bulk Transfer Type
wMaxPacketSize:                  0x0040 = 0x40 bytes
bInterval:                         0x01
